{"eval_receipt_digest":"761004e82f0f55405fd25e96a5f80a0eb0849bcd6f722b2cce4e24e30bb9699a","events":[{"seq":1,"summary":"Add the approved incident note to INC-1006.","type":"request"},{"data":{"model_id":"fixture","policy_version":"opsdesk-v1","provider_id":"fixture","scenario_id":"S08_PROCESS_KILL_RESUME"},"seq":2,"summary":"run.started","type":"run.started"},{"data":{"count":0,"memory_ids":[],"operation":"load"},"seq":3,"summary":"memory.read","type":"memory.read"},{"data":{"evidence_ids":["30527b795930f9d270ab47ed9a78bd5c29c13fb6b2d206f1d805615cb2576dec","962b352580762fde01edc1296120f6b08c80242f9fc875fd6a876d3cfbe9fa64","96658780768661ac6351b48914c3a5eaba3b23769b5a2d57ae372ebd00ca4f62","ae780674a53eeadb509fa563699626d55696f71587b112deabef6bb227edfbd5","bf5412a584b2e09bf389a11f52c1a5a5589286d994983240a4c3cb83007f5efe","fd3034fce65b418c919cee09a58df4835cc3e4fb66b2ea21044e90a56ac1118b"],"result_count":6,"source_paths":["docs/project/spec/v1.0/fixtures/knowledge/runbook-checkout.md","docs/project/spec/v1.0/fixtures/knowledge/service-catalog.md","docs/project/spec/v1.0/fixtures/knowledge/policy-approvals.md","docs/project/spec/v1.0/fixtures/knowledge/untrusted-vendor-note.md","docs/project/spec/v1.0/fixtures/knowledge/policy-retries.md","docs/project/spec/v1.0/fixtures/knowledge/runbook-search.md"]},"seq":4,"summary":"retrieval.completed","type":"retrieval.completed"},{"data":{"count":0,"memory_ids":[],"operation":"resolve"},"seq":5,"summary":"memory.read","type":"memory.read"},{"data":{"finish_reason":"tool_calls","model_id":"fixture","model_step":1,"provider_id":"fixture","tool_names":["add_incident_note"],"usage":null},"seq":6,"summary":"model.completed","type":"model.completed"},{"data":{"action_digest":"5b7d1af1b7cf809182887e8b0e449b08c724f7cdcc93c5e8a886b952a0819067","action_id":"81f84fd37f1542d99160d7380b8cba06","risk_class":"SIDE_EFFECT","tool_name":"add_incident_note"},"seq":7,"summary":"action.validated","type":"action.validated"},{"data":{"approval_required":true,"risk_class":"SIDE_EFFECT","tool_name":"add_incident_note"},"seq":8,"summary":"policy.evaluated","type":"policy.evaluated"},{"data":{"action_digest":"5b7d1af1b7cf809182887e8b0e449b08c724f7cdcc93c5e8a886b952a0819067","approval_id":"378d3f237fcca4a0c7c058ccdd55023dbfd87d04f622a0bde46c356b80e515a5","status":"PENDING"},"seq":9,"summary":"approval.waiting","type":"approval.waiting"},{"data":{"action_digest":"5b7d1af1b7cf809182887e8b0e449b08c724f7cdcc93c5e8a886b952a0819067","approval_id":"378d3f237fcca4a0c7c058ccdd55023dbfd87d04f622a0bde46c356b80e515a5","status":"APPROVED"},"seq":10,"summary":"approval.resumed","type":"approval.resumed"},{"data":{"checkpoint_id":"1f1c0e66-7912-650d-8007-36aba6a4e1a5","kind":"checkpoint_continuation"},"seq":11,"summary":"recovery.resumed","type":"recovery.resumed"},{"data":{"receipt_id":"f3ff84804efbf055efcd34cc318e957ebc21ccf313289ee4c08ae9ce8c6df7b9","replayed":true,"result_digest":"2edb4596da860fd0f9c313aa053e1fbb191093748bd37311a7f9d43bc6923aea","risk_class":"SIDE_EFFECT","success":true,"tool_name":"add_incident_note"},"seq":12,"summary":"tool.completed","type":"tool.completed"},{"data":{"count":0,"memory_ids":[],"operation":"resolve"},"seq":13,"summary":"memory.read","type":"memory.read"},{"data":{"finish_reason":"stop","model_id":"fixture","model_step":2,"provider_id":"fixture","tool_names":[],"usage":null},"seq":14,"summary":"model.completed","type":"model.completed"},{"data":{"model_steps":2,"sanitized_final_text":"Incident and service inspected. Follow the supplied runbook; side effects require exact approval. [evidence:30527b795930f9d270ab47ed9a78bd5c29c13fb6b2d206f1d805615cb2576dec] [evidence:962b352580762fde01edc1296120f6b08c80242f9fc875fd6a876d3cfbe9fa64]","status":"COMPLETED","terminal_reason":null,"tool_steps":1},"seq":15,"summary":"run.finalized","type":"run.finalized"},{"data":{"gates":{"HARD_INVARIANTS":"PASS","L0_SCHEMA_MECHANISM":"PASS","L1_RETRIEVAL":"NOT_APPLICABLE","L2_TRAJECTORY":"PASS","L3_ENVIRONMENT":"PASS","L4_ANSWER_QUALITY":"NOT_APPLICABLE","TASK_SUCCESS":"PASS"},"receipt_digest":"761004e82f0f55405fd25e96a5f80a0eb0849bcd6f722b2cce4e24e30bb9699a"},"seq":16,"summary":"Accepted evaluation receipt","type":"eval.acceptance"}],"final_status":"COMPLETED","mode":"recorded_acceptance_replay","run_id":"138c54724e954a3ea3499d70d58cb877","scenario_id":"S08_PROCESS_KILL_RESUME","schema_version":"1.0","source_git_sha":"83514ebad336dbd6faf1b790c597ec8037be0874"}